{
  "schemaVersion": 1,
  "name": "Velvet",
  "colors": {
    "app": "#24202d",
    "panel": "#332b40",
    "raised": "#453954",
    "hover": "#554564",
    "line": "#17131f",
    "border": "#847294",
    "ink": "#f5ebff",
    "muted": "#c8b9d4",
    "tab": "#dc9bea",
    "tabInk": "#25122e",
    "accent": "#80e2d0",
    "caret": "#80e2d0",
    "selection": "#80e2d066",
    "menu": "#24202d",
    "menuEdge": "#847294"
  },
  "drawing": {
    "laneGround": "#292332",
    "lane": "#2d2637",
    "laneAlt": "#332c40",
    "grid": "#17131f",
    "gridMinor": "#241e2c"
  }
}
